{
  "schemaVersion": 1,
  "columns": 100,
  "rows": 30,
  "mode": "pipe",
  "commands": [
    {
      "stepId": "run-inspect",
      "command": "node",
      "args": [
        "packages/cli/dist/index.js",
        "inspect",
        "."
      ],
      "cwd": ".",
      "startedAt": 0,
      "durationMs": 274,
      "status": "completed",
      "exitCode": 0
    }
  ],
  "events": [
    {
      "sequence": 0,
      "t": 0,
      "stepId": "run-inspect",
      "stream": "input",
      "data": "node packages/cli/dist/index.js inspect .\n"
    },
    {
      "sequence": 1,
      "t": 262,
      "stepId": "run-inspect",
      "stream": "stdout",
      "data": "DemoWeave inspected demoweave-workspace\n"
    },
    {
      "sequence": 2,
      "t": 262,
      "stepId": "run-inspect",
      "stream": "stdout",
      "data": "Languages: TypeScript (19), Go (2), JavaScript (2), Python (2), Rust (2)\nDetected surfaces:\n  - library    @demoweave/core\n  - library    @demoweave/drivers\n  - library    @demoweave/renderer\n  - terminal   demoweave\nWrote .demoweave/project.json\n"
    }
  ],
  "status": "completed",
  "exitCode": 0,
  "durationMs": 274
}
